{
  "title": "Encontrando Significado na Vida - Iniciante - Beginner",
  "dimension": "mentalHealth",
  "archetype": "explorer",
  "relatedToType": "GENERIC",
  "relatedToId": "meaningful-life-beginner",
  "estimatedDuration": 420,
  "coinsReward": 30,
  "flexibleItems": [
    {
      "type": "quote",
      "content": "O progresso acontece através de pequenos passos consistentes.",
      "author": "Ari"
    },
    {
      "type": "content",
      "content": "1. Definição de vida significativa.\n2. Entendimento dos cinco pilares: amor, transcendência, propósito, beleza e resiliência.\n3. Como estes pilares podem trazer significado e satisfação para a vida.",
      "author": "Ari"
    },
    {
      "type": "quiz",
      "question": "Qual é o conceito principal sobre Encontrando Significado na Vida?",
      "options": [
        "Desenvolvimento pessoal",
        "Ciência comportamental",
        "Mudança de hábitos",
        "Autoconhecimento"
      ],
      "correctAnswer": 0,
      "explanation": "O desenvolvimento pessoal é fundamental para mudanças sustentáveis."
    },
    {
      "type": "content",
      "content": "Conceito 1: Amor é uma fonte de significado. \nConceito 2: Existem diferentes tipos de amor: romântico, fraternal, amor próprio e amor pela humanidade.",
      "author": "Ari"
    },
    {
      "type": "quiz",
      "question": "Como aplicar Encontrando Significado na Vida no dia a dia?",
      "options": [
        "Pequenos passos",
        "Mudanças radicais",
        "Esperar motivação",
        "Ignorar dificuldades"
      ],
      "correctAnswer": 0,
      "explanation": "Pequenos passos garantem progresso consistente e sustentável."
    },
    {
      "type": "quote",
      "content": "A ciência comportamental nos ensina que mudanças sustentáveis começam devagar.",
      "author": "Ari"
    }
  ],
  "metadata": {
    "generated_by": "lyfe-kt-structural-v1.0",
    "generation_timestamp": "2025-08-06T13:27:54.226844",
    "ari_persona_applied": true,
    "difficulty_level": "beginner",
    "source_template": "arthurcbrooks_mostmeaning_extracted_filled_template.md",
    "template_metadata": {
      "source_file": "arthurcbrooks_mostmeaning_extracted_filled_template.md",
      "source_path": "work/02_preprocessed/arthurcbrooks_mostmeaning_extracted_filled_template.md",
      "file_size": 4462,
      "modification_time": "2025-08-06T13:27:09.230034",
      "frontmatter_keys": [
        "title",
        "description",
        "target_audience",
        "difficulty_level",
        "estimated_time",
        "dimension",
        "archetype",
        "related_to_type",
        "related_to_id",
        "estimated_duration",
        "coins_reward",
        "language",
        "region",
        "learning_objectives",
        "prerequisites",
        "tags"
      ],
      "processing_timestamp": "2025-08-06T13:27:16.008205"
    },
    "language": "portuguese",
    "region": "Brazil",
    "created_at": "2025-08-06T13:27:54.226873",
    "updated_at": "2025-08-06T13:27:54.226875",
    "version": "1.0.0"
  }
}