{
  "title": "Encontrando Significado na Vida - Iniciante - Beginner",
  "dimension": "mentalHealth",
  "archetype": "explorer",
  "relatedToType": "GENERIC",
  "relatedToId": "meaningful-life-beginner",
  "estimatedDuration": 420,
  "coinsReward": 30,
  "flexibleItems": [
    {
      "type": "content",
      "content": "1. Definição de vida significativa.\n2. Os cinco pilares: amor, transcendência, propósito, beleza e resiliência.\n3. Como esses pilares contribuem para uma vida significativa.\n4. Importância da satisfação na vida diária.",
      "author": "Ari"
    },
    {
      "type": "quiz",
      "question": "Qual é o conceito fundamental sobre Encontrando Significado na Vida?",
      "options": [
        "Conceitos básicos",
        "Aplicações práticas",
        "Definições essenciais",
        "Fundamentos"
      ],
      "correctAnswer": 2,
      "explanation": "As definições básicas são como alicerces para aprender. Elas ajudam a entender melhor tudo o que vem depois."
    },
    {
      "type": "content",
      "content": "O amor é um sentimento poderoso e significativo. Ele não é apenas romântico, mas também pode ser fraternal, pela própria pessoa, ou pela humanidade.",
      "author": "Ari"
    },
    {
      "type": "quote",
      "content": "O progresso acontece através de pequenos passos consistentes.",
      "author": "Ari"
    },
    {
      "type": "content",
      "content": "Conceito 1: \"Amor\" - É mais do que apenas emoção; envolve ações e comportamentos.\n\nConceito 2: \"Transcendência\" - A capacidade de ver além do presente, conectando-se com algo maior.",
      "author": "Ari"
    },
    {
      "type": "quiz",
      "question": "Quais são os elementos básicos de Encontrando Significado na Vida?",
      "options": [
        "Componentes simples",
        "Estruturas complexas",
        "Análises profundas",
        "Teorias avançadas"
      ],
      "correctAnswer": 0,
      "explanation": "Iniciar com partes fáceis ajuda a entender melhor. Assim, você aprende aos poucos e se prepara para conceitos mais complexos."
    }
  ],
  "metadata": {
    "generated_by": "lyfe-kt-structural-v1.0",
    "generation_timestamp": "2025-08-06T14:24:43.339147",
    "ari_persona_applied": true,
    "difficulty_level": "beginner",
    "source_template": "arthurcbrooks_mostmeaning_extracted_filled_template.md",
    "template_metadata": {
      "source_file": "arthurcbrooks_mostmeaning_extracted_filled_template.md",
      "source_path": "work/02_preprocessed/arthurcbrooks_mostmeaning_extracted_filled_template.md",
      "file_size": 4462,
      "modification_time": "2025-08-06T14:23:53.788084",
      "frontmatter_keys": [
        "title",
        "description",
        "target_audience",
        "difficulty_level",
        "estimated_time",
        "dimension",
        "archetype",
        "related_to_type",
        "related_to_id",
        "estimated_duration",
        "coins_reward",
        "language",
        "region",
        "learning_objectives",
        "prerequisites",
        "tags"
      ],
      "processing_timestamp": "2025-08-06T14:23:59.061645"
    },
    "language": "portuguese",
    "region": "Brazil",
    "created_at": "2025-08-06T14:24:43.339171",
    "updated_at": "2025-08-06T14:24:43.339173",
    "version": "1.0.0"
  }
}