{
  "title": "Aplicando Conexões Humanas na Vida Real",
  "dimension": "mentalHealth",
  "archetype": "sage",
  "relatedToType": "GENERIC",
  "relatedToId": "aplicando_conexoes_humanas_na_vida_real",
  "estimatedDuration": 300,
  "coinsReward": 200,
  "flexibleItems": [
    {
      "type": "content",
      "content": "Investir em relacionamentos e conexões humanas não é um luxo, mas uma necessidade. Assim como cuidamos da nossa alimentação e fazemos exercícios, também devemos cultivar nossas conexões sociais. Esta é uma parte fundamental do nosso bem-estar.",
      "author": "Ari",
      "tips": [
        "Crie o hábito de se conectar com pelo menos uma pessoa por dia, mesmo que seja uma conversa rápida."
      ]
    },
    {
      "type": "quiz",
      "question": "Por que é importante investir em relacionamentos e conexões humanas?",
      "options": [
        "Para ter uma vida social agitada",
        "Para evitar a solidão",
        "Para aumentar a autoestima",
        "Todas as opções acima"
      ],
      "correctAnswer": 1,
      "explanation": "Investir em relacionamentos e conexões humanas é crucial para evitar a solidão, que pode levar a sérios problemas de saúde física e mental."
    },
    {
      "type": "content",
      "content": "Se você se sente constantemente sozinho, tente se envolver em atividades de grupo que você goste, como aulas de dança, grupos de leitura ou times de esportes. Essas atividades não só permitem que você se divirta, mas também criam oportunidades para conhecer novas pessoas e construir conexões significativas.",
      "author": "Ari",
      "tips": [
        "Escolha atividades que você realmente goste para garantir que você continue a participar regularmente."
      ]
    },
    {
      "type": "quote",
      "content": "Cultivar conexões humanas não é apenas sobre evitar a solidão, mas também sobre enriquecer nossas vidas com experiências compartilhadas.",
      "author": "Ari"
    },
    {
      "type": "content",
      "content": "Lembre-se, construir conexões significativas leva tempo. Não desanime se você não se sentir imediatamente conectado. Continue se esforçando para se envolver e compartilhar experiências com os outros.",
      "author": "Ari",
      "tips": [
        "Seja paciente consigo mesmo. Construir conexões significativas leva tempo e esforço."
      ]
    },
    {
      "type": "quiz",
      "question": "Qual das seguintes ações é a mais eficaz para combater a solidão crônica?",
      "options": [
        "Ignorar seus sentimentos",
        "Passar mais tempo sozinho",
        "Cultivar conexões sociais significativas",
        "Comer alimentos não saudáveis"
      ],
      "correctAnswer": 2,
      "explanation": "Cultivar conexões sociais significativas é a maneira mais eficaz de combater a solidão crônica. Ignorar seus sentimentos ou passar mais tempo sozinho pode exacerbar a solidão."
    }
  ],
  "metadata": {
    "language": "portuguese",
    "region": "brazil",
    "created_at": "2025-08-06T00:00:00Z",
    "updated_at": "2025-08-06T00:00:00Z",
    "version": "1.1"
  }
}