{
  "title": "Integração Solidão Crônica: Priorizando Conexões Sociais",
  "dimension": "mentalHealth",
  "archetype": "sage",
  "relatedToType": "GENERIC",
  "relatedToId": "solidao_cronica_-_integration_integration",
  "estimatedDuration": 360,
  "coinsReward": 500,
  "flexibleItems": [
    {
      "type": "content",
      "content": "A solidão crônica é um sério problema de saúde física e mental, afetando milhões de pessoas mundialmente. Os impactos na saúde são comparáveis a comportamentos de risco bem conhecidos, como fumar.",
      "author": "Ari",
      "tips": [
        "Reserve tempo para interagir socialmente todos os dias, mesmo que virtualmente"
      ]
    },
    {
      "type": "quiz",
      "question": "A solidão crônica afeta apenas a saúde mental. Verdadeiro ou falso?",
      "options": [
        "Verdadeiro",
        "Falso"
      ],
      "correctAnswer": 1,
      "explanation": "Falso. A solidão crônica afeta tanto a saúde emocional quanto a física. Os efeitos na saúde física podem ser comparáveis aos de comportamentos de risco conhecidos, como fumar."
    },
    {
      "type": "content",
      "content": "Manter conexões sociais fortes é fundamental para uma vida saudável e longa. O isolamento social pode aumentar o risco de morte prematura em 26%.",
      "author": "Ari",
      "tips": [
        "Cultive a empatia e a compreensão para fortalecer suas conexões existentes"
      ]
    },
    {
      "type": "quote",
      "content": "Conexões humanas são tão importantes quanto exercícios ou alimentação para a sua saúde.",
      "author": "Ari"
    },
    {
      "type": "content",
      "content": "Investir em relacionamentos e conexões humanas não é um luxo, mas uma necessidade. Assim como cuidamos da nossa alimentação e fazemos exercícios, também devemos cultivar nossas conexões sociais.",
      "author": "Ari",
      "tips": [
        "Se envolva em atividades de grupo que você goste, como aulas de dança, grupos de leitura ou times de esportes"
      ]
    },
    {
      "type": "quiz",
      "question": "Qual das seguintes ações é a mais eficaz para combater a solidão crônica?",
      "options": [
        "Ignorar seus sentimentos",
        "Passar mais tempo sozinho",
        "Cultivar conexões sociais significativas",
        "Comer alimentos não saudáveis"
      ],
      "correctAnswer": 2,
      "explanation": "A solidão crônica é melhor combatida através do cultivo de conexões sociais significativas. Ignorar seus sentimentos ou passar mais tempo sozinho pode exacerbar a solidão."
    }
  ],
  "metadata": {
    "language": "portuguese",
    "region": "brazil",
    "created_at": "2025-08-06T00:00:00Z",
    "updated_at": "2025-08-06T00:00:00Z",
    "version": "1.1"
  }
}