{
  "title": "Encontrando Significado na Vida - Iniciante - Beginner",
  "dimension": "mentalHealth",
  "archetype": "explorer",
  "relatedToType": "GENERIC",
  "relatedToId": "meaningful-life-beginner",
  "estimatedDuration": 420,
  "coinsReward": 30,
  "flexibleItems": [
    {
      "type": "quote",
      "content": "O progresso acontece através de pequenos passos consistentes.",
      "author": "Ari"
    },
    {
      "type": "content",
      "content": "Ter uma vida com sentido pode ser difícil. Porém, se focarmos em cinco coisas importantes - amor, superação, objetivo, beleza e força para resistir a dificuldades - podemos nos sentir mais felizes e completos no dia a dia.",
      "author": "Ari"
    },
    {
      "type": "quiz",
      "question": "Qual é o conceito principal sobre Encontrando Significado na Vida?",
      "options": [
        "Desenvolvimento pessoal",
        "Ciência comportamental",
        "Mudança de hábitos",
        "Autoconhecimento"
      ],
      "correctAnswer": 0,
      "explanation": "O desenvolvimento pessoal é fundamental para mudanças sustentáveis."
    },
    {
      "type": "content",
      "content": "Pilar 1: Amor. O amor é como um superpoder. Não é só o amor de namorados, mas também o amor entre irmãos, o amor que temos por nós mesmos e o amor que sentimos por todas as pessoas do mundo.",
      "author": "Ari"
    },
    {
      "type": "quiz",
      "question": "Como aplicar Encontrando Significado na Vida no dia a dia?",
      "options": [
        "Pequenos passos",
        "Mudanças radicais",
        "Esperar motivação",
        "Ignorar dificuldades"
      ],
      "correctAnswer": 0,
      "explanation": "Pequenos passos garantem progresso consistente e sustentável."
    },
    {
      "type": "quote",
      "content": "A ciência comportamental nos ensina que mudanças sustentáveis começam devagar.",
      "author": "Ari"
    }
  ],
  "metadata": {
    "generated_by": "lyfe-kt-structural-v1.0",
    "generation_timestamp": "2025-08-06T13:19:11.495587",
    "ari_persona_applied": true,
    "difficulty_level": "beginner",
    "source_template": "arthurcbrooks_mostmeaning_extracted_filled_template.md",
    "template_metadata": {
      "source_file": "arthurcbrooks_mostmeaning_extracted_filled_template.md",
      "source_path": "work/02_preprocessed/arthurcbrooks_mostmeaning_extracted_filled_template.md",
      "file_size": 4462,
      "modification_time": "2025-08-06T13:12:16.194539",
      "frontmatter_keys": [
        "title",
        "description",
        "target_audience",
        "difficulty_level",
        "estimated_time",
        "dimension",
        "archetype",
        "related_to_type",
        "related_to_id",
        "estimated_duration",
        "coins_reward",
        "language",
        "region",
        "learning_objectives",
        "prerequisites",
        "tags"
      ],
      "processing_timestamp": "2025-08-06T13:18:36.777660"
    },
    "language": "portuguese",
    "region": "Brazil",
    "created_at": "2025-08-06T13:19:11.495611",
    "updated_at": "2025-08-06T13:19:11.495613",
    "version": "1.0.0"
  }
}