{
  "title": "Mastering Meaningful Living - Foundation",
  "dimension": "mentalHealth",
  "archetype": "sage",
  "relatedToType": "GENERIC",
  "relatedToId": "mastering_meaningful_living_foundation",
  "estimatedDuration": 180,
  "coinsReward": 100,
  "flexibleItems": [
    {
      "type": "content",
      "content": "üå± Construindo sua base de conhecimento... (1/3)",
      "author": "Ari"
    },
    {
      "type": "content",
      "content": "Viver uma vida com significado √© como pintar um quadro com as cores da felicidade. Uma das maiores fontes dessas cores √© o amor. O amor √© como uma l√¢mpada que ilumina a escurid√£o, dando prop√≥sito e alegria √† nossa exist√™ncia.",
      "author": "Ari",
      "tips": [
        "üí° Dica b√°sica: Fa√ßa um esfor√ßo consciente para expressar amor todos os dias, seja para um ente querido, um amigo ou"
      ]
    },
    {
      "type": "quiz",
      "question": "Como aplicar Mastering Meaningful Living no dia a dia?",
      "options": [
        "Fa√ßa um esfor√ßo consciente para expressar amor todos os",
        "Ignorar completamente",
        "Esperar motiva√ß√£o",
        "Apenas teoria"
      ],
      "correctAnswer": 0,
      "explanation": "Esta aplica√ß√£o funciona porque Fa√ßa um esfor√ßo consciente para expressar amor todos os dias, seja para um ente ."
    },
    {
      "type": "content",
      "content": "Ter um prop√≥sito na vida √© como ter uma b√∫ssola interna que nos guia e motiva. Independentemente de qual seja o seu prop√≥sito, seja servir aos outros, buscar conhecimento ou criar algo novo, ele fornece uma dire√ß√£o para onde voc√™ deseja ir e o que deseja alcan√ßar.",
      "author": "Ari",
      "tips": [
        "üí° Dica b√°sica: Identifique um prop√≥sito em sua vida, como servir aos outros, buscar conhecimento ou criar algo novo"
      ]
    },
    {
      "type": "quote",
      "content": "Todo grande conhecimento come√ßa com um primeiro passo.",
      "author": "Prov√©rbio"
    },
    {
      "type": "content",
      "content": "Viver de forma significativa √© uma arte que se aprimora com o tempo. Um dos segredos para isso √© aprender a apreciar a beleza √† nossa volta. N√£o s√≥ as grandes obras de arte ou as maravilhas da natureza, mas tamb√©m os pequenos momentos que, normalmente, passam despercebidos.",
      "author": "Ari",
      "tips": [
        "üí° Dica b√°sica: Fa√ßa um esfor√ßo consciente para notar e apreciar a beleza no dia a dia, seja na arte, na natureza ou"
      ]
    },
    {
      "type": "quiz",
      "question": "Como aplicar Mastering Meaningful Living no dia a dia?",
      "options": [
        "Identifique um prop√≥sito em sua vida, como servir aos o",
        "Ignorar completamente",
        "Esperar motiva√ß√£o",
        "Apenas teoria"
      ],
      "correctAnswer": 0,
      "explanation": "Esta aplica√ß√£o funciona porque Identifique um prop√≥sito em sua vida, como servir aos outros, buscar conheciment."
    }
  ],
  "metadata": {
    "language": "portuguese",
    "region": "brazil",
    "created_at": "2025-08-06T00:00:00Z",
    "updated_at": "2025-08-06T00:00:00Z",
    "version": "1.1",
    "learning_level": "foundation",
    "narrative_theme": "Mastering Meaningful Living"
  }
}